{
  "schema_version": "1.0",
  "run_id": "synthetic_all_scroll",
  "status": "complete",
  "scope": {
    "kind": "simulation_only",
    "audience_version": "zh_x_v1",
    "behavior_prior_version": "silent_v1",
    "seed": 42,
    "planned_rounds": 3,
    "completed_rounds": 3,
    "calibrated": false,
    "evidence_truncated": false
  },
  "metrics": {
    "planned_agents": 120,
    "exposed_agents": 120,
    "evaluated_agents": 120,
    "missing_agents": 0,
    "action_counts": {
      "none": 120,
      "like": 0,
      "reply": 0,
      "repost": 0,
      "quote": 0
    },
    "root_engaged_agents": 0,
    "none_rate": 1,
    "engagement_rate": 0
  },
  "usage": {
    "currency": "USD",
    "budget_microusd": 1000000,
    "charged_microusd": 0,
    "reserved_microusd": 0,
    "uncertain_microusd": 0,
    "billable_tokens": 0,
    "physical_requests": 0,
    "price_version": "synthetic_mock_v1",
    "cost_basis": "provider_usage"
  },
  "engagement": {
    "tier": "low",
    "tier_reason": "120次有效曝光全部划走，没有原帖互动。",
    "rate_interval": {
      "lower": 0,
      "upper": 0
    },
    "meaning": "仅描述当前模拟样本的互动，不预测真实浏览量或点赞数。"
  },
  "trigger_lines": [],
  "top_replies": [],
  "backlash_risk": {
    "level": "low",
    "rule_version": "risk_rules_v1",
    "issues": [],
    "limitations": [
      "没有观察到负面发言，不代表真实发布没有风险。"
    ]
  },
  "disagreement": {
    "views": [],
    "silent_agents_are_not_supporters": true,
    "note": "未产生公开观点，无法从沉默判断立场。"
  },
  "rewrites": [
    {
      "variant": "preserve_claim",
      "text": "我想尝试用AI辅助写作。",
      "what_changed": "保留使用AI写作的主张，改为个人计划。",
      "changed_spans": [
        {
          "start": 0,
          "end": 3,
          "text": "所有人"
        }
      ],
      "expected_effect": {
        "hypothesis": "可能减少读者被要求接受统一标准的感觉。",
        "tradeoff": "语气更弱，也可能减少讨论。",
        "simulation_verified": false
      }
    },
    {
      "variant": "add_boundaries",
      "text": "对一些初稿任务，可以试试用AI辅助写作。",
      "what_changed": "将普遍要求收窄为具体任务中的可选方法。",
      "changed_spans": [
        {
          "start": 0,
          "end": 3,
          "text": "所有人"
        }
      ],
      "expected_effect": {
        "hypothesis": "可能让建议的适用范围更清楚。",
        "tradeoff": "不再保留原文强烈的号召语气。",
        "simulation_verified": false
      }
    }
  ],
  "confidence": {
    "level": "low",
    "calibration_status": "uncalibrated",
    "basis": "合成契约示例，未经历史结果校准。",
    "uncertainties": [
      "受众比例是工程假设。",
      "真实推荐算法和发布环境未知。",
      "120个虚构账号不能代表中文X总体。"
    ]
  },
  "limitations": [
    "此例是合成测试，不是历史推文结果。"
  ],
  "degradation_reasons": []
}
